title,score,id,subreddit,url,num_comments,body,created,timestamp
BTCUSD bounced multiple times on those points means?,0,1gqohcw,CryptoMarkets,https://www.reddit.com/r/CryptoMarkets/comments/1gqohcw/btcusd_bounced_multiple_times_on_those_points/,1,"I saw that the BTCUSD bounced several times on a line created on a timechart of 5m between 12:40, 14:15, 15:00, 16:15. what does it indicate? ",2024-11-13 15:44:27,1731534267.0
Opinion on Alts?,1,1gqo3y3,CryptoMarkets,https://www.reddit.com/r/CryptoMarkets/comments/1gqo3y3/opinion_on_alts/,36,"Like the title suggests Im looking for opinions on the Alts Im holding for this bull run.

Currently I’m holding AVAX, XRP, DOT, HBAR, QNT, and POL.  

What you think? Whats good? Whats bad?",2024-11-13 15:28:48,1731533328.0
My theory on bitcoin EOY,16,1gqnolx,CryptoMarkets,https://www.reddit.com/r/CryptoMarkets/comments/1gqnolx/my_theory_on_bitcoin_eoy/,6,"Bitcoin? Look, a lot of people ask me about Bitcoin. They come up, 'Sir, will Bitcoin hit the big number by EOY?' And I say, 'Well, first of all, EOY—End of Year—that’s a powerful phrase, a very strong phrase. People love it. They really love it. But I have to say, no one’s ever done more for big numbers than me. No one. We used to have very small numbers, folks, very small numbers. And now, under my influence, we have HUGE numbers. Tremendous numbers.

They say, 'Sir, do you think Bitcoin will make it?' And I tell them, 'It’s not about making it. Bitcoin, it’s been on a journey, folks. A beautiful journey. Like a phoenix, up and down, up and down, very dramatic—some people say too dramatic.' I don’t know about that, but I do know a thing or two about making numbers great again.

And let me tell you something, if Bitcoin is gonna make it by EOY, it's going to be because of—what?—me. It’s not gonna happen because of Sleepy Joe, believe me. That I can tell you. You know what they say about Bitcoin? Digital gold. They say, 'Sir, it’s the digital gold.' And I say, 'Look, I know gold, folks. Beautiful, shiny, tremendous. And Bitcoin? It’s got the same energy, okay? It’s got spirit.' So will it reach the moon by EOY? Well, I don’t know, but I can tell you this: with me, it's got a chance. The best chance. Thank you, thank you very much.",2024-11-13 15:10:56,1731532256.0
Peanut The Squirrel (PNUT) Jumps 269% After Musk Gives Hints,4,1gqnkal,CryptoMarkets,https://dailycoin.com/peanut-the-squirrel-pnut-jumps-235-after-musk-gives-hints/,1,,2024-11-13 15:05:50,1731531950.0
Is quantum apocalypse a threat?,4,1gqmwlg,CryptoMarkets,https://www.reddit.com/r/CryptoMarkets/comments/1gqmwlg/is_quantum_apocalypse_a_threat/,7,"Having said that the path to quantum computing is everything but certain, let's assume an effective Q.C. comes to life in 20 or 30 years from now. What's the chance of BTC being hacked, given that the king of cryptocurrencies relies on a very ""standard"" hash algorithm, which is not quantum resistant and making it quantum resistant would imply a fork (or multiple disordered forks), which would mean the end of the cryptocurrency as we know it as well?
If so, wouldn't it be enough to drop every investment on any cryptocurrency, hence the collapse of BTC triggers the fall of all the crypto market, even if some cryptocurrencies are quantum resistant?
Moreover BTC has a lot of downsides such as a massive centralization (the majority of hash power is controlled by 5 miners more or less), bad scalability and strong environmental issues due to power consumption.
I would prefer the opinion of experts who can mention the sources, thank you.",2024-11-13 14:38:15,1731530295.0
"FBI Seizes Polymarket CEO’s Devices Following Accurate Trump Victory Prediction
",9,1gqmusn,CryptoMarkets,https://cryptomars.net/fbi-seizes-polymarket-ceos-devices-following-accurate-trump-victory-prediction/,7,,2024-11-13 14:36:13,1731530173.0
"Now, everything is almost at its ATH -- be it BTC, ETH, or even DOGE to make fortune-turning money. What are the next big cryptos that you will be telling BTC-like stories about in a decade? And why?
",0,1gqmrqt,CryptoMarkets,https://www.reddit.com/r/CryptoMarkets/comments/1gqmrqt/now_everything_is_almost_at_its_ath_be_it_btc_eth/,37,"# Now, everything is almost at its ATH -- be it BTC, ETH, or even DOGE to make fortune-turning money. What are the next big cryptos that you will be telling BTC-like stories about in a decade? And why?

[](https://www.reddit.com/r/CryptoCurrency/?f=flair_name%3A%22ADVICE%22)",2024-11-13 14:32:44,1731529964.0
Will altseason actually happen in this run ?,24,1gqlwg4,CryptoMarkets,https://www.reddit.com/r/CryptoMarkets/comments/1gqlwg4/will_altseason_actually_happen_in_this_run/,99,"You could argue that it's happening right now, but I'm talking in a scale that we saw in 2021, where even actual monkeys made 5x on their investments. right now very specific coins (and meme coins) are pumping, 80% of  alts are 60-90% below their 2021 ATH, and BTC keeps pumping like crazy. 

do you think this time will be different? BTC will keep pumping to 100k(+-), everyone will sell and the market will dump hard and that will be it for this run? 

",2024-11-13 13:56:21,1731527781.0
Ready to put 5k somewhere for long term,14,1gqla70,CryptoMarkets,https://www.reddit.com/r/CryptoMarkets/comments/1gqla70/ready_to_put_5k_somewhere_for_long_term/,82,"At least 5+ years. I asked yesterday about 2k but after jointing this group I’m so inspired
So if you were me going to invest right now

Currently have 2k in USDC

1. How would you spread this out over BTC ETH AND…?
I use met ask and still working it all out 
Thanks guys! Xxx",2024-11-13 13:30:08,1731526208.0
XRP is hyped due to market cap?,4,1gql870,CryptoMarkets,https://www.reddit.com/r/CryptoMarkets/comments/1gql870/xrp_is_hyped_due_to_market_cap/,40,"I'm new to this area but I already seen a lot of XRP hype up videos/posts/tweets but I don't really get it. It's out for some time, it has big market cap but it's still extremely low on price (IDK how much SEC is contributed to that low price).

So simply put I don't get it and I would not like to ask it on XRP reddit as I'm afraid of somewhat biased opinions.",2024-11-13 13:27:53,1731526073.0
New player is looking for some guidance,8,1gql4yi,CryptoMarkets,https://www.reddit.com/r/CryptoMarkets/comments/1gql4yi/new_player_is_looking_for_some_guidance/,28,"I'm new in crypto market but trying to learn and catch up rapidly.

I plan to invest on long term for holding.

My question would be relative....strange to many I think. (It sounds strange to me but interested how you all think about it).

I had the idea to build up my portfolio by spending 100-200$ weekly with something like this:

For every $100 I would buy: 

* $50 BTC 
* $30 ETH
* $20 SOL

Otherwise if this is not a valid idea I would just invest in either BTC due to obvious reasons, or SOL becase it's still in that affordable range however I'm unsure how this slow build up would work out.",2024-11-13 13:24:03,1731525843.0
Web Summit 2024: Hyperchains break down blockchain barriers,2,1gqkv73,CryptoMarkets,https://cointelegraph.com/press-releases/web-summit-2024-hyperchains-break-down-blockchain-barriers,0,,2024-11-13 13:12:50,1731525170.0
Just the start? ,13,1gqjxfb,CryptoMarkets,https://www.reddit.com/r/CryptoMarkets/comments/1gqjxfb/just_the_start/,63,"I keep seeing half of these people on crypto posts saying we are almost at bitcoins peak and the other half are saying we’re just getting started.  Wondering what your opinions are? 

Thanks,",2024-11-13 12:34:23,1731522863.0
What the Best Leveraged Trading Exchanged for Bitcoin?,5,1gqht1j,CryptoMarkets,https://www.reddit.com/r/CryptoMarkets/comments/1gqht1j/what_the_best_leveraged_trading_exchanged_for/,8,"Hi Guys,

 I would love to do Leveraged Trading. I believe bitcoin will hit to 100k. It will go up or down, but regardless I believe it will hit 100k.  

I would love to a 10x, 100x or even 1000x leveraged trading if possible. I know the risk. But I want to do leveraged trading with a negative balance protection. 

I don't mind losing $100.

My strategy is that I will not lose more than my inital deposit. I'm from Canada and I was wondering what Crypto Exchange that is Safe and Regulated Allowed this? 

I saw Kraken and created an account. I noticed they only do 5x Leveraged and no Negative Balance Protection.

  
This is Basically the Scenario I want. What place does this.

Scenario:

**Position Details**: You start with a $5000 position (5x leverage on your $1000 investment).

1. **Price Movement**: Bitcoin’s 5% price increase raises the position’s value by $250.
2. **Profit Calculation**: This $250 gain is added to your initial $1000, giving you a total of $1250.
3. **Profit Percentage**: Your gain on the initial investment is $250 on $1000, equating to a 25% return.

* **5% Bitcoin Increase** = **$500 profit** (50% return on your initial investment)
* **5% Bitcoin Decrease** = **$500 loss** (50% loss on your initial investment)
* **10% Bitcoin Decrease** = **Liquidation** and loss of entire $1000 investment.

# But won't lose more than the $1000.",2024-11-13 11:07:32,1731517652.0
Why you shouldn't worry buying an ATH - Follow up,22,1gqh9s4,CryptoMarkets,https://www.reddit.com/r/CryptoMarkets/comments/1gqh9s4/why_you_shouldnt_worry_buying_an_ath_follow_up/,13,"To add onto this post [https://www.reddit.com/r/CryptoMarkets/comments/1gp44kh/why\_you\_should\_not\_worry\_buying\_ath/](https://www.reddit.com/r/CryptoMarkets/comments/1gp44kh/why_you_should_not_worry_buying_ath/)

  
Which has garnered the attention of 70,000+ people. The idea is to not worry about buying an ATH into a clear bull market with a higher uptrend. Since posting, BTC has gained around 10% and alts varying, but higher.

  
Obviously each week that goes by, less and less gains will be achievable.

  
I believe BTC will form at the 100K for psychological reasons and then money will flow to ETH/SOL. 

  
**""The best time to plant a tree was yesterday, the second best time is now"". DCA and forget :)**",2024-11-13 10:45:28,1731516328.0
Is this a scam RXS? ,1,1gqh8k0,CryptoMarkets,https://www.reddit.com/r/CryptoMarkets/comments/1gqh8k0/is_this_a_scam_rxs/,13,"Is Rexas finance a scam or legit? 
I would like to invest a bit into crypto. What do you guys recommend? ",2024-11-13 10:44:02,1731516242.0
Top 5 Platforms Simplifying Web3 Rewards For Businesses,36,1gqh7rm,CryptoMarkets,https://thecryptobasic.com/2024/11/07/top-5-platforms-simplifying-web3-rewards-for-businesses/,5,,2024-11-13 10:43:06,1731516186.0
Selling,5,1gqguox,CryptoMarkets,https://www.reddit.com/r/CryptoMarkets/comments/1gqguox/selling/,22,Is it worth selling bitcoin plus alts on the run up to 100k and buying it all back once it inevitably falls? Or is that just stupid as we can never time the market?,2024-11-13 10:28:09,1731515289.0
How hard is it to get a meme coin listed on Binance,7,1gqgg24,CryptoMarkets,https://www.reddit.com/r/CryptoMarkets/comments/1gqgg24/how_hard_is_it_to_get_a_meme_coin_listed_on/,8,"Everywhere I look is giving me a different answer online. Does anyone have first hand knowledge of this or even a credible information that would help!

Cheers

",2024-11-13 10:11:18,1731514278.0
"Bitcoin Rises Above $90,000 and Doge Soars as ‘Trump & Elon Rally Resumes on DOGE News",11,1gqf0wh,CryptoMarkets,https://www.bloomberg.com/news/articles/2024-11-13/bitcoin-btc-rally-cools-trump-announcement-lifts-dogecoin-doge,5,,2024-11-13 09:10:29,1731510629.0
Ineed your insight about investing in Scroll protocol coin !,0,1gqe0wx,CryptoMarkets,https://www.reddit.com/r/CryptoMarkets/comments/1gqe0wx/ineed_your_insight_about_investing_in_scroll/,4,"

I need your deep insight about the Scroll project!

-Their vision looks solid and currently it's around it's all time low with only 190M tokens in the circulation and a total of 1B tokens.

- And the market cap is around 120 million only , do you think it's a good call for spot? Is it going to explode into billions in term of market cap or have no interest at all during this bull run?

I have missed a ton of opportunities in this bullrun and afraid of going empty handed please guide me! ",2024-11-13 08:24:57,1731507897.0
"Daily Discussion Megathread - November 13, 2024 (GMT+0)",3,1gqba2i,CryptoMarkets,https://www.reddit.com/r/CryptoMarkets/comments/1gqba2i/daily_discussion_megathread_november_13_2024_gmt0/,9,This post contains content not supported on old Reddit. [Click here to view the full post](https://sh.reddit.com/r/CryptoMarkets/comments/1gqba2i),2024-11-13 06:00:23,1731499223.0
Helium Mining in 24'?,0,1gq4lyd,CryptoMarkets,https://www.reddit.com/r/CryptoMarkets/comments/1gq4lyd/helium_mining_in_24/,0,"I don't like investing in crypto, but I'd like to mine it. Are those helium connection miners still worthit to pay themselves off within a year or two? Give me the basic rundown of how these work and how long it would take me to mine/ connect enough to make a return on my purchase. Also explain in idiot terms, I'm not smart when it comes to mining or crypto for that matter. Thanks!",2024-11-12 22:18:45,1731471525.0
Praying my bag of Alts + cash reserve for dips gives me an opportunity to cash out a large enough bag for BTC..,1,1gpz7r2,CryptoMarkets,https://www.reddit.com/r/CryptoMarkets/comments/1gpz7r2/praying_my_bag_of_alts_cash_reserve_for_dips/,0,"My story is a frustrating one. Been around since Feb 21 and I’ve gone from 5k to 6 figs and back again a few times gambling in the trenches.. all in all I’m up about 10k over that time. I was so depressed about it I just left crypto this January. 

My wife wants a house so since then, all my extra wage + commission has gone into a savings.. I literally walked away and for 9 months I had not been on telegram or X once. In that time I saved enough for a good deposit and enough to look at buying additional property/properties with end of year commission. (Software Consultant) I had been fighting FOMO since October but decided today that I cannot just sit on the sidelines! 

I’m playing it “safe” and betting on a strong EOY/Q1 

I haven’t gone out of the top 60. 50% of my money in Alts the other 50% ready to buy dips. 

I’m not installing TG, Nor X I’m following a couple old dogs Coin bureau and Lark Davis 

If I can…. 3-5x between now and March I think I’ll be happy. No fucking around anymore.. i have a £15 a day auto buy on BTC I intend to rock out for the long haul. 

My the crypto gods have mercy on us all 🫡",2024-11-12 17:48:49,1731455329.0
Theta ,2,1gq7sqf,CryptoMarkets,https://www.reddit.com/r/CryptoMarkets/comments/1gq7sqf/theta/,1,"About 30% of my portfolio is in theta ,starting to wonder if it’s a good hold with upcoming bullmarket ,I’m hoping it gets neck to it ATH of $24AUD ,but also been thi king of dumping it for doge ,what do you guys think ?",2024-11-13 01:46:03,1731483963.0
Defi trading platforms ,3,1gq4bjz,CryptoMarkets,https://www.reddit.com/r/CryptoMarkets/comments/1gq4bjz/defi_trading_platforms/,8,"Hi everyone! I was wondering, is there a decentralized trading platform where I can buy/sell cryptocurrency with limit orders, stop loss, auto sell ecc? Like an advanced trading platform, not centralised? 

Please do not suggest photon on Solana cause I know it already and its pretty scammy imo. 

Thanks in advance. ",2024-11-12 22:02:22,1731470542.0
Rate my portfolio,10,1gq28ld,CryptoMarkets,https://www.reddit.com/r/CryptoMarkets/comments/1gq28ld/rate_my_portfolio/,49,"Rate my portfolio 

Been in crypto for a while and constantly buy and sell into coin that shine which fucks me up as they pull back ,really need to just hold what I have ,I don’t have any BTC or ETH which I know you all will recommend 
I have a $30k AUD portfolio made up of 
Chainlink 50%,theta 25%,solana 20%and Pepe  10%
Will this do well if I hold through coming bullmarket .",2024-11-12 20:13:32,1731464012.0
Elon Musk heads up Department of Government Efficiency… coincidence?,5,1gq1pp1,CryptoMarkets,https://nypost.com/2024/11/12/us-news/trump-announces-elon-musk-vivek-ramaswamy-to-lead-new-department-of-government-efficiency/,24,"I am pretty new to crypto, but I find it hard to believe that this is a coincidence that he’s cabinet position is a DOGE acronym. Would something like this affect the market?

(I apologize in advance if this is not the correct sub for this)",2024-11-12 19:47:18,1731462438.0
LINK ,1,1gpyrhp,CryptoMarkets,https://www.reddit.com/r/CryptoMarkets/comments/1gpyrhp/link/,6,"A lot of positive sentiment for LINK, but its performance has taken a hit with the recent dip. What is everyone’s thoughts on this, and who else thinks this is a good play?",2024-11-12 17:27:46,1731454066.0
What are some things to look for when investing?,9,1gpxqjb,CryptoMarkets,https://www.reddit.com/r/CryptoMarkets/comments/1gpxqjb/what_are_some_things_to_look_for_when_investing/,33,"What exactly should I look for when choosing a coin to dump into ? I so far look at the coin’s history, monthly , weekly Then I google / Reddit search 
But surly there’s a better way ",2024-11-12 16:41:30,1731451290.0
Hold or sell? I’m new to crypto,0,1gpv2sy,CryptoMarkets,https://www.reddit.com/r/CryptoMarkets/comments/1gpv2sy/hold_or_sell_im_new_to_crypto/,5,"I’ve invested a little bit of money last year in crypto and I got decent returns but due to some personal reasons I had to withdraw almost half of my wallet. 
I’m still holding the other half of it and they’re about x3 of initially what I invested. Should I hold longer and wait or just pull my profits out? 
I’m new to crypto with zero knowledge just thought I’d invest some money last year due to the hype of crypto currency and I’m aware crypto is not a place where you hold long term. 
Any suggestions from fellow experienced traders would be much appreciated. ",2024-11-12 14:49:15,1731444555.0
XRP is HOT 📈 📈 📈,0,1gpulj1,CryptoMarkets,https://www.reddit.com/r/CryptoMarkets/comments/1gpulj1/xrp_is_hot/,5,Just randomly checked and this coin is going up so much... could we see $1 before the end of the day?,2024-11-12 14:29:32,1731443372.0
Does anyone know any API to track token info only by the ticker?,2,1gptaef,CryptoMarkets,https://www.reddit.com/r/CryptoMarkets/comments/1gptaef/does_anyone_know_any_api_to_track_token_info_only/,0,"
I don't know how to solve this problem, I need to track some token prices from a user request, but the user only has a token ticker/symbol, like per example, $MEW.

How to track that token information (contract address, price etc) when I have only the ticker?

A way I imagined is getting a list of tokens deployed with that name and sort by the one with most volume, but I didn't find any API that returns token addresses by the symbol only.",2024-11-12 13:35:33,1731440133.0
Why do people say take profits and move to BTC rather than USDC/Cash?,1,1gpnj8i,CryptoMarkets,https://www.reddit.com/r/CryptoMarkets/comments/1gpnj8i/why_do_people_say_take_profits_and_move_to_btc/,1,"I am hearing from many sources that when taking profits you should move them over to BTC rather than USDC.

Why is this the case? Wouldn't that put profits at risk if BTC goes down while you are waiting for good re-entry prices for altcoins?

Only reason I can see to move profits to BTC while we are on the current uptrend, is that BTC is also going up too. Whereas USDC/Cash would be doing nothing.

So the question is, is it best to take profits and move to BTC now. Then as BTC begins to top out in 2025, move profits to USDC/Cash for the next bear cycle?",2024-11-12 09:39:23,1731425963.0
Is it safe to access Binance in the US using VPN?,2,1gpsmzx,CryptoMarkets,https://www.reddit.com/r/CryptoMarkets/comments/1gpsmzx/is_it_safe_to_access_binance_in_the_us_using_vpn/,6,Help me guys. I am here in the US now and want to access my Binance account to do trading. I am just a bit hesitant and afraid that my account might get banned. I availed a Cyberghost VPN account use here. Thoughts? Thanksssss,2024-11-12 13:09:06,1731438546.0
"Curious: Wondering what we can buy right now that can give 10x, 20x return. ",10,1gprbab,CryptoMarkets,https://www.reddit.com/r/CryptoMarkets/comments/1gprbab/curious_wondering_what_we_can_buy_right_now_that/,247,"I am just curious and kinda want to experiment with some money on this. I know it might sound stupid and may even be a longshot but what are your thoughts on what someone should purchase if they want 10x/20x return or maybe more. 

TIA. ",2024-11-12 12:15:08,1731435308.0
What apps are you using to buy / sell?,9,1gpq3ty,CryptoMarkets,https://www.reddit.com/r/CryptoMarkets/comments/1gpq3ty/what_apps_are_you_using_to_buy_sell/,33,"I’ve recently got into the crypto game 
I use Coinbase but I’m seeing allot of backlash on Coinbase for multiple reasons but the biggest is You don’t actually own the coin and
You can’t cash out if/when you win big ",2024-11-12 11:26:15,1731432375.0
Use purposes for Crypto?,1,1gppiv0,CryptoMarkets,https://www.reddit.com/r/CryptoMarkets/comments/1gppiv0/use_purposes_for_crypto/,22,What are going to be the best cryptocurrencies for actual use and how will they work… Kind of new to crypto but I’m 40 so I’ve been around to see things. Just curious about what regulations would release a real time type of use?,2024-11-12 11:02:20,1731430940.0
CryptoMarkets?,0,1gpox2k,CryptoMarkets,https://www.reddit.com/r/CryptoMarkets/comments/1gpox2k/cryptomarkets/,7,"The only crypto market existing today is one of scam and robbery. It's ALL scam! Only getting bigger because there is no policing. The only people making money with corruptocurrency are the scammers. They won't get caught. They are the only ones making money.

Run fool, run",2024-11-12 10:37:44,1731429464.0
Bitcoin Google search spike after Trump victory signals retail investor interest,80,1gpnvne,CryptoMarkets,https://cointelegraph.com/news/trump-bitcoin-google-investors,18,,2024-11-12 09:54:10,1731426850.0
Trust Wallet Safe?,1,1gpmi73,CryptoMarkets,https://www.reddit.com/r/CryptoMarkets/comments/1gpmi73/trust_wallet_safe/,0,"I have been seeing alot of people having thier trust wallets hacked or funds being depleted, what good wallets do you guys use? i personally have exodus but that app moves slow for me and i have a note 10 plus. Whats yall views?",2024-11-12 08:54:20,1731423260.0
Is sol gonna crash ?,0,1gpkm1g,CryptoMarkets,https://www.reddit.com/r/CryptoMarkets/comments/1gpkm1g/is_sol_gonna_crash/,36,"Was watching sol & am thinking about doubling down now it’s on the correction. 
What’s your guys outtakes on sol ? Ball or bust ?",2024-11-12 07:23:26,1731417806.0
 Why Protection Fund is an important factor to consider in selecting a Crypto exchange,0,1gpk78b,CryptoMarkets,https://www.reddit.com/r/CryptoMarkets/comments/1gpk78b/why_protection_fund_is_an_important_factor_to/,1," When I’m choosing a crypto exchange, one of the first things I look at is how well they protect their users. That’s why Bitget’s Protection Fund stands out to me. It’s one of the largest self-insured funds in the industry, designed to shield users from risks like hacks, fraud, and sudden market crashes.

Here’s what really caught my attention: in October 2024, the fund’s value ranged from $391 million to $473 million, with an average of $424 million. And earlier this year, it even hit a high of $543 million in February. That kind of growth and stability is impressive.

What makes it even better is the fund’s diversified portfolio, holding assets like BTC, USDT, and USDC. This ensures it remains stable and liquid, even during market turbulence. For me, knowing there’s a solid safety net like this gives me a lot more confidence when trading on the exchange

",2024-11-12 07:02:13,1731416533.0
10 X ALTs?,0,1gpjyzr,CryptoMarkets,https://www.reddit.com/r/CryptoMarkets/comments/1gpjyzr/10_x_alts/,37,"I'm heavily invested in btc and Eth, I have some fun money to chuck into mid risk ALTs in the 10 x arena.
Initial list
Ondo
Aptos
Beam
Dogwif
Tao
Near

Any thoughts guys and dolls?",2024-11-12 06:50:10,1731415810.0
Which crypto prop firm has the most symbols / assets to trade from? ,0,1gpjx7q,CryptoMarkets,https://www.reddit.com/r/CryptoMarkets/comments/1gpjx7q/which_crypto_prop_firm_has_the_most_symbols/,0,Hey guys. I am looking to take a prop firm challenge with a crypto funnding company. My biggest question is; which prop firm offers the most symbols / assets to trade from? The more the merrier for my planned strategy. ,2024-11-12 06:47:24,1731415644.0
When would the elections effect end?,0,1gpijma,CryptoMarkets,https://www.reddit.com/r/CryptoMarkets/comments/1gpijma/when_would_the_elections_effect_end/,22,"So as the title suggests, when do you think the effects of the elections and trump winning end and prices go back down to normal? And is it safe to make quick investments and sell them for some quick money before everything goes back to normal so i can invest and hold?",2024-11-12 05:25:00,1731410700.0
"Daily Discussion Megathread - November 12, 2024 (GMT+0)",2,1gpj3ic,CryptoMarkets,https://www.reddit.com/r/CryptoMarkets/comments/1gpj3ic/daily_discussion_megathread_november_12_2024_gmt0/,0,This post contains content not supported on old Reddit. [Click here to view the full post](https://sh.reddit.com/r/CryptoMarkets/comments/1gpj3ic),2024-11-12 06:00:31,1731412831.0
Analysts Speculate on Solana Price Potential to Hit $300,0,1gpiitw,CryptoMarkets,https://cryptoalerts.hashnode.dev/analysts-speculate-on-solana-price-potential-to-hit-300,1,,2024-11-12 05:23:34,1731410614.0
