title,score,id,subreddit,url,num_comments,body,created,timestamp
So I’ve just recently started a DCA bot with small investments that have been making me a nice amount of profit….,2,1guahmp,CryptoMarkets,https://www.reddit.com/r/CryptoMarkets/comments/1guahmp/so_ive_just_recently_started_a_dca_bot_with_small/,5,"My question is, have I just entered at the right time without knowing? Will it eventually get bad? Or shall I start investing more money in base orders for more gains as I have been making around £70 a day.

Id appreciate any advice from people who have been using DCA bots/ DCA strategies!",2024-11-18 11:39:31,1731951571.0
VET to BTC,1,1gu9pc7,CryptoMarkets,https://www.reddit.com/r/CryptoMarkets/comments/1gu9pc7/vet_to_btc/,0,How can I trade VECHAIN VET for BTC on a Dex or maybe a non-kyc VEX? This seems to be very problematic so far and I do not know which exchanges are safe anymore.,2024-11-18 11:08:14,1731949694.0
Is it possibile to influence crypto market?,0,1gu9bsm,CryptoMarkets,https://www.reddit.com/r/CryptoMarkets/comments/1gu9bsm/is_it_possibile_to_influence_crypto_market/,6,"""A new coin is fast growing its value: I have to buy it right now!""

How much money is required to ""boost"" some crypto in order to make it ""trending"" on major platforms, so you can sell everything right after and get free money?",2024-11-18 10:53:16,1731948796.0
XLM Stellar,1,1gu436k,CryptoMarkets,https://www.reddit.com/r/CryptoMarkets/comments/1gu436k/xlm_stellar/,0,"I got a question for your opinion. I already hold some stellar. I bought them when the price were 0,11€. 
It keeps going up all the time. I’m waiting for a big correction but it seems like it will take a lot time until this will happen. Do you think I should buy already now more stellar? I’m not sure to wait or to buy more ",2024-11-18 06:57:31,1731934651.0
New tokens. Where do you go for research?,0,1gu85ey,CryptoMarkets,https://www.reddit.com/r/CryptoMarkets/comments/1gu85ey/new_tokens_where_do_you_go_for_research/,0,"Exactly what the title says really. Where do you go for research to find out about new ideas and tokens that are launching. I was about in 2017 when the ICO boom was on, there was a coin talk forum that people used to post new ICO projects to, but I can’t recall it, or even know if it’s still the place to go? ",2024-11-18 10:04:56,1731945896.0
Help! New to Stocks,0,1gu6vd1,CryptoMarkets,https://www.reddit.com/r/CryptoMarkets/comments/1gu6vd1/help_new_to_stocks/,0,"Hello! I’m new here and also new to RobinHood stocks!

I have a question! I’ve recently invested into crypto. Upon withdrawing from the stock, onto my robinhood account, and instantly on to my bank account, it added the funds as “credit.” Now I think I understand the gist of it… but upon using the funds a fee has appeared. I was wondering if this happens to anyone else? And how does it work? Do I get charged for using the “credit” I received? I would love for someone to explain to me how to buy/sell crypto and properly understand all of this works. ",2024-11-18 09:10:05,1731942605.0
Polygon gas,0,1gu6i9a,CryptoMarkets,https://www.reddit.com/r/CryptoMarkets/comments/1gu6i9a/polygon_gas/,0,"Can anyone help with 0.1 poly? xd  
I'm stuck with USDT,poly with no Poly in wallet for gas  
0xCa6d68464e9A1a49CDb4Aa0ce45e72720B03087A

Thank you",2024-11-18 08:53:59,1731941639.0
The Future of Nvidia Stock: A Quantum Leap?,5,1gu3zgv,CryptoMarkets,https://elblog.pl/2024/11/14/the-future-of-nvidia-stock-a-quantum-leap/,8,"This has major implications for the crypto space.  First, it's very clear that the risk of capable quantum computers will force us to change cryptography. 

They are telling ALL SYSTEMS to start looking at how to implement NIST solutions. 

The cryptography that protects your private key will need to change.  

This will not be easy and won't be backward compatible. Reaching consensus and building will take years. 

As for impacts to the crypto market, certainly projects who provide the best solutions will have a major advantage.

Recently, before this news, QANPlatform joined the Linux Post Quantum Cryptography Alliance.  

There are only about 20 members,  and you guessed it NVIDIA is there also. 

Along with IBM GOOGLE AWS CISCO META",2024-11-18 06:51:45,1731934305.0
XRP Predictions?,0,1gu3vw1,CryptoMarkets,https://www.reddit.com/r/CryptoMarkets/comments/1gu3vw1/xrp_predictions/,54,"So i have seen allot on internet about XRP, what could XRP actually do in the future? Is it still worth buying it right now? They all say when the bullrun hits its going to go up to $30 per coin. Is this even possible? En when should the next bullrun be?

(Im new to crypto so im trying to learn about it)",2024-11-18 06:46:13,1731933973.0
ETH is just an absolute embarrassment,0,1gu3hru,CryptoMarkets,https://www.reddit.com/r/CryptoMarkets/comments/1gu3hru/eth_is_just_an_absolute_embarrassment/,29,"Why would anyone buy ETH??? Inflationary, less generates fees than Solana, insane fees on main-net, slow and low TPS, regarded co founder who does nothing but talk about wanting people to stake from their nokia phones instead of working on things that matter etc. Seriously on the verge of just selling my bags. I can't take it anymore

",2024-11-18 06:23:35,1731932615.0
Bull Run Dilemma: Exit Strategy vs Asset Security,1,1gu3hi7,CryptoMarkets,https://www.reddit.com/r/CryptoMarkets/comments/1gu3hi7/bull_run_dilemma_exit_strategy_vs_asset_security/,1,"There’s a major issue during a bull run: how to combine an effective exit strategy with securing your assets.

Let me explain: when using a CEX, you can optimize your exit strategy with tiered reverse DCA or even more advanced orders like trailing stops or OCO orders. This is crucial because, during a bull run, speed of execution is key, and you can’t automate these kinds of strategies on a DEX with a hot wallet, let alone with a cold wallet, which might take hours or even days to transfer your assets.

However, keeping your funds on a CEX exposes you to risks like hacks or the platform going bankrupt, which isn’t ideal either.

Is there a solution to combine the security of a cold wallet with the reliable execution of an advanced exit strategy?

(Of course, I’m not talking here about long-term assets like BTC, ETH, or SOL that we intend to keep post-bull run and can safely remain in a cold wallet.)",2024-11-18 06:23:08,1731932588.0
"Daily Discussion Megathread - November 18, 2024 (GMT+0)",1,1gu3436,CryptoMarkets,https://www.reddit.com/r/CryptoMarkets/comments/1gu3436/daily_discussion_megathread_november_18_2024_gmt0/,0,This post contains content not supported on old Reddit. [Click here to view the full post](https://sh.reddit.com/r/CryptoMarkets/comments/1gu3436),2024-11-18 06:00:30,1731931230.0
HELP - Im confusing myself big time! Eth-BTC,2,1gu25ht,CryptoMarkets,https://www.reddit.com/r/CryptoMarkets/comments/1gu25ht/help_im_confusing_myself_big_time_ethbtc/,5,"Hello all, think I am overthinking this and really not getting to a solution/understanding.  
First time ever looking at a Coin V Coin comparison instead of a Coin V Currency.  
When the chart is at the bottom for ETH-BTC for example instead of at the top, is that the time to buy or does that mean ETH is weaker against the BTC? So buying should be done if using ETH to swap to BTC when the graph is at the top. Just validate my thinking please.",2024-11-18 04:55:58,1731927358.0
Solana DEX Breaks $5B in Daily Trading for 3 Days Straight,2,1gu13ap,CryptoMarkets,https://en.cryptonomist.ch/2024/11/18/solana-dex-breaks-5b-daily-trading-3-days-straight/,4,,2024-11-18 03:36:06,1731922566.0
Is a DIP coming or will the train move without me.,19,1gu0ent,CryptoMarkets,https://www.reddit.com/r/CryptoMarkets/comments/1gu0ent/is_a_dip_coming_or_will_the_train_move_without_me/,74,"I have 4k I want to invest in XRP, XLM, SUI, SEI, OM or/and some other Alts. I know it's not much but I just want to get in.

I've been watching the marked for 10 days non stop waiting for a good entry but it feels like I never get the chance and the shit keeps pumping.

Should I just stay patient and believe the dip is coming ? I don't want to FOMO in again (my speciality BTW).

I need a plan, I'm totally lost.
HELP this lost soul with knowledge and guidance

EDIT: F*CK IT, I PULLED THE TRIGGER INVESTED IN:
1.XLM
2.ONDO
3.SEI
4.SUI 

KEPT HALF TO DCA/DIP.

",2024-11-18 02:41:52,1731919312.0
"Solana (SOL) Set for All-Time High, Buy Opportunity?",2,1gu02jr,CryptoMarkets,https://equatorial-sting-704.notion.site/Solana-SOL-Set-for-All-Time-High-Buy-Opportunity-142e7bb243f880d580fcef8ad2f67eb9,1,,2024-11-18 02:15:12,1731917712.0
Chamath Palihapitiya is worth over $4B right now. You might think that his biggest regret has nothing to do with Bitcoin. Yet Chamath Palihapitiya's biggest regret is selling his Bitcoin. Yet ...,4,1gtyvcz,CryptoMarkets,https://v.redd.it/a7kzzk1jwl1e1,2,,2024-11-18 00:46:35,1731912395.0
"XRP , WIF Doge",0,1gty7xj,CryptoMarkets,https://www.reddit.com/r/CryptoMarkets/comments/1gty7xj/xrp_wif_doge/,18,"I have a total of 5k shares of xrp at the moment bought at .60 should I buy more shares while it’s in the 1.10-1.20 range or just hold. Already doubled my money 

WIF, bought 650 shares at  3.60 it had already had a run but has been holding in the range is it smart to hold or just sell.

Doge. Total of 17k shares , had 50k shares at .14 but sold early tough loss. Bought another 10k shares at .24 so made profit on that. Then another 7k shares at .40 so lost a bit on that overall profit still should I hold or sell or overall? Sucks i had 50k shares at .14 got Ancy smh",2024-11-18 00:03:27,1731909807.0
What is the best platform to have DOM trading crypto ,2,1gty5k3,CryptoMarkets,https://www.reddit.com/r/CryptoMarkets/comments/1gty5k3/what_is_the_best_platform_to_have_dom_trading/,1,"and busbc status, I have heard of cscalp and another one that looks like leon, so which one is the best to have dom (deep of market), I would like to know your experiences to choose the best. ",2024-11-17 23:59:44,1731909584.0
What to do with a fee extra bucks?,5,1gtwxtg,CryptoMarkets,https://www.reddit.com/r/CryptoMarkets/comments/1gtwxtg/what_to_do_with_a_fee_extra_bucks/,32,"I'm one of those that sometimes goes months and months without checking my wallets, just realized I've had $250 cash just sitting there. 
Might as well make it do something,  what should I grab for only $250?

I'm toe dipped into XRP, Doge and Shibu

Should I go in more XRP? I see wildly opposite arguments in both directions for XRP. Some say it's shit, some say it's going to explode.

SOL - only can afford 1 coin, not sure that'd be worth it?

SUI? I've been reading good things. 

Do I buy more Doge? I have no idea what's going to happen with the new US administration and Elon being the new ""first buddy""...

Is HBAR really going to keep growing? Seems like it was hot on 22 and fell for the last 2 years...

$250 isn't a big deal but it's not doing anything just sitting there. ",2024-11-17 22:45:10,1731905110.0
are there any new exchanges out that are cheap asf for scalping,2,1gtuxx0,CryptoMarkets,https://www.reddit.com/r/CryptoMarkets/comments/1gtuxx0/are_there_any_new_exchanges_out_that_are_cheap/,1,"it doesn't have to actually be an exchange but any platform that has good order execution, tight spreads and low asf taker fees (preferably don't suggest one of the top 15 exchanges on google)",2024-11-17 20:54:20,1731898460.0
Cronos CDC,5,1gtuchm,CryptoMarkets,https://www.reddit.com/r/CryptoMarkets/comments/1gtuchm/cronos_cdc/,2,"Guys,

What’s your take with CDC and CRO?

Their road map is massive and d they are expanding like crazy. 

Next BNB?",2024-11-17 20:22:31,1731896551.0
Hamsters v2 on Solana… Anyone else watching this?,0,1gttrt3,CryptoMarkets,https://www.reddit.com/r/CryptoMarkets/comments/1gttrt3/hamsters_v2_on_solana_anyone_else_watching_this/,0,"Hey everyone,

Remember the buzz around Hamsters v1? It introduced live-streamed hamster races where we could bet on our favorite furballs using the HAMS token. It was a fun concept that brought a unique twist to crypto gaming.

Now, Hamsters v2 has launched on Solana, and I'm curious about what new features or improvements it brings to the table. The original platform allowed us to engage in live races and place bets, which was pretty entertaining.

For those who were part of the v1 experience, how does v2 compare? Have they enhanced the racing experience or introduced new elements to keep things fresh? And for newcomers, does the idea of live-streamed hamster races pique your interest?

Let's discuss! What are your thoughts on Hamsters v2? Is it a fun novelty, or does it have the potential to become a staple in the crypto gaming world?

Looking forward to hearing your insights!",2024-11-17 19:52:45,1731894765.0
Pepe still poppin!? ,0,1gtr15p,CryptoMarkets,https://www.reddit.com/r/CryptoMarkets/comments/1gtr15p/pepe_still_poppin/,17,Fucked up and shoulda sold all my shit coins and tokens invested all in Pepe before the 30% hike in profit - dogwifhat seems like a flop. Any recommendations or possible advice? Thanks in advance! ,2024-11-17 17:38:27,1731886707.0
Need Help With Newly Launched Solana Token,0,1gtqv5g,CryptoMarkets,https://www.reddit.com/r/CryptoMarkets/comments/1gtqv5g/need_help_with_newly_launched_solana_token/,9,"Hello there,

I just recently launched a Solana token just for the fun of it and am now pondering what to do with it LOL

Am looking for advice and help with this project to see if it's worth keeping alive.

  
Happy to discuss in more detail if anyone is interested in learning more.

  
Kindest regards,

Kevin

  
",2024-11-17 17:30:19,1731886219.0
Will ETH Keep Up with BTC This Cycle?,24,1gtnjmr,CryptoMarkets,https://www.reddit.com/r/CryptoMarkets/comments/1gtnjmr/will_eth_keep_up_with_btc_this_cycle/,60,"My crypto portfolio is 80% ETH and 20% BTC, so I hope I'm wrong, but:

I keep reading about the altcoin cycle and how the ETH/BTC ratio will rise, similar to what happened four years ago. However, I feel this time is different. I'm not saying ETH won’t rise a bit, but the gap in interest between Bitcoin and Ethereum seems enormous.

From ETFs to headlines about countries or institutions wanting to hold BTC reserves, the focus overwhelmingly seems to be on Bitcoin.

What are the reasons to remain optimistic that ETH won't completely lag behind BTC this cycle?",2024-11-17 15:01:00,1731877260.0
Bitcoin likely to cross 100k before the inauguration day in the US?,32,1gtmioe,CryptoMarkets,/r/Bitcoin/comments/1gthmg1/bitcoin_likely_to_cross_100k_before_the/,18,,2024-11-17 14:15:14,1731874514.0
New to crypto need advice,0,1gtkuq3,CryptoMarkets,https://www.reddit.com/r/CryptoMarkets/comments/1gtkuq3/new_to_crypto_need_advice/,14,"This person recently dmed me saying i should do some staking. 
She told me to get uniswap an app and then go on a website called project mainnet .com and to ""decentralized"" my wallet. The website asked me for my 12 word thingy and i did a quick search and i have suspicion itd a scam but im not sure. 
Is she legit? Or is this a scam. ",2024-11-17 13:02:11,1731870131.0
Pepe Video,2,1gtjb67,CryptoMarkets,https://www.reddit.com/r/CryptoMarkets/comments/1gtjb67/pepe_video/,0,"Does anyone have that video of Pepe and a person watching a screen of market chart, it falls but they HODL and then it Rallies, making them filthy rich?",2024-11-17 11:54:56,1731866096.0
is movement.market legit?,1,1gtj9ek,CryptoMarkets,https://www.reddit.com/r/CryptoMarkets/comments/1gtj9ek/is_movementmarket_legit/,1,"its on the App Store and someone on here told me it was good, however I looked it up and I didn't see anyone else talk about it. On the site it allows you to buy crypto with only a card and email.",2024-11-17 11:52:45,1731865965.0
Degen?,1,1gtiz35,CryptoMarkets,https://www.reddit.com/r/CryptoMarkets/comments/1gtiz35/degen/,3,"Does anyone have any thoughts on Degen? I don't know much about it, but I put some money on it and it's been consistently growing for awhile now. I'm having trouble finding any conversations about this coin, so I'm just curious if it's considered a strong one or if I should take what gains I've made and dip to another coin. It seems to fluctuate a lot, but ultimately it's only increased in value over the last couple weeks. I'm just nervous to get caught up waiting for bigger and bigger gains just for it to crash!",2024-11-17 11:40:18,1731865218.0
El Salvador and Bhutan are boldly taking significant risks by investing in cryptocurrency.,0,1gtioei,CryptoMarkets,https://www.reddit.com/r/CryptoMarkets/comments/1gtioei/el_salvador_and_bhutan_are_boldly_taking/,2,"**Even as other governments explore the technology, El Salvador and Bhutan represent two of the handful of countries to have adopted blockchain as part of their national strategies—and, at least for now, have profited handsomely off the gamble. Is the U.S. behind the curve? Are these small countries leading the way? If Trump chooses Howard Lutnick as Treasury Secretary will we be next?**",2024-11-17 11:27:14,1731864434.0
Best resources for learning to trade,3,1gthuss,CryptoMarkets,https://www.reddit.com/r/CryptoMarkets/comments/1gthuss/best_resources_for_learning_to_trade/,5,"Hi there 

Been in the space for a while but looking to start trading a little.

What are some good, no shill, no bs recourses for a beginner to get going?

I’ve been told CryptoCred and his courses are good.

Any other recommendations?",2024-11-17 10:52:33,1731862353.0
CBDCs Unveiled: The Future of Money and the Digital Financial Revolution,1,1gthgrn,CryptoMarkets,https://www.reddit.com/r/CryptoMarkets/comments/1gthgrn/cbdcs_unveiled_the_future_of_money_and_the/,0,"I just read the blog on the rise of [Central Bank Digital Currencies (CBDCs)](https://cryptomarketbuz.com/the-rise-of-cbdcs/), and it really got me thinking about how digital money is evolving. It explains how CBDCs could make payments faster and more secure while opening up financial access for people who don’t have traditional banking.   
  
But it doesn’t shy away from discussing the challenges, like privacy concerns and the potential risks of centralization. The examples of countries exploring CBDCs were particularly interesting, showing how this technology might reshape global finance. Definitely worth a read!",2024-11-17 10:35:45,1731861345.0
ETH to altcoins,18,1gtheqd,CryptoMarkets,https://www.reddit.com/r/CryptoMarkets/comments/1gtheqd/eth_to_altcoins/,44,"At the current price, I have almost 2.5x my original investment in ETH. To increase my gains, I'm considering selling my ETH to increase my position in some altcoins (ADA, AVAX, LINK, XRP, SOL, and SUI). However, I am not sure it would he worth the risk. If I decide to stick with ETH, how likely am I to see more significant growth? Would like to hear some opinions on this strategy. ",2024-11-17 10:33:15,1731861195.0
Alternative strategy? ,1,1gtdupm,CryptoMarkets,https://www.reddit.com/r/CryptoMarkets/comments/1gtdupm/alternative_strategy/,3,"Hi Guys, I know that this is mainly about Crypto Markets... 

but have you guys thought of alternative strategies to gain crypto too?

Like being a liquidity provider, etc?",2024-11-17 07:44:36,1731851076.0
Why Altcoins are related to BTC? Is this tendency over?,12,1gtdnpv,CryptoMarkets,https://www.reddit.com/r/CryptoMarkets/comments/1gtdnpv/why_altcoins_are_related_to_btc_is_this_tendency/,18,"First thing first. 5 years ago I made a mistake. When I approached this world and read about some projects, I didn't choose bitcoin. I thought and I think it's an obsolete blockchain. My mistake was that I couldn't see it as a store of value. 

For that reason I built a small long term portfolio with my internship's earnings based on ETH, SOL, DOT mainly and 2 more ones. Obviously I'm not rich now. Observing the market during these years I have noticed that when BTC drops, all the altcoins do the same; and vice versa. 

If we see ETH, SOL, DOT as blockchains more efficient than BTC one, why their prices are still related to BTC?",2024-11-17 07:33:53,1731850433.0
South Korea Cracks Down on Upbit Over Alleged 600K KYC Violations,4,1gtd2m9,CryptoMarkets,https://secret3.com/news/south-korea-cracks-down-on-upbit-over-alleged-600k-kyc-violations/,0,,2024-11-17 07:02:07,1731848527.0
"Daily Discussion Megathread - November 17, 2024 (GMT+0)",2,1gtc2cd,CryptoMarkets,https://www.reddit.com/r/CryptoMarkets/comments/1gtc2cd/daily_discussion_megathread_november_17_2024_gmt0/,2,This post contains content not supported on old Reddit. [Click here to view the full post](https://sh.reddit.com/r/CryptoMarkets/comments/1gtc2cd),2024-11-17 06:00:19,1731844819.0
Crypto app,3,1gtbxng,CryptoMarkets,https://www.reddit.com/r/CryptoMarkets/comments/1gtbxng/crypto_app/,5,I am very new to crypto trading. I have been using Robinhood for my stocks and realised the spread for crypto. Which crypto app is best for small amounts of trading with low fees?,2024-11-17 05:51:10,1731844270.0
Advice for noob,0,1gtapk4,CryptoMarkets,https://www.reddit.com/r/CryptoMarkets/comments/1gtapk4/advice_for_noob/,4,"Been out of work a whole so couldn't invest.  Seen sol go from 100 to 187£  

We in bull market? Are these the lows. Feel like the ship has sailed. 

Any tips to maximise my gains ir trading. Want to take full advantage of this cycle ",2024-11-17 04:23:08,1731838988.0
An Interview With El Salvador’s Top Crypto Regulator: ‘Developing Countries Can Lead the Financial Revolution’,2,1gta1e2,CryptoMarkets,https://www.coindesk.com/policy/2024/11/16/an-interview-with-el-salvadors-top-crypto-regulator-developing-countries-can-lead-the-financial-revolution,0,,2024-11-17 03:33:30,1731836010.0
"These 14 U.S. Companies have $811 BILLION in cash and ZERO Bitcoin, except for Tesla. We could also add to this list Berkshire Hathaway which has over $300B in cash and ZERO Bitcoin. Every year that cash loses purchasing power. Who will be the first to follow the path paved by Michael J. Saylor?",7,1gta1a0,CryptoMarkets,https://i.redd.it/53vjlwkalf1e1.jpeg,8,,2024-11-17 03:33:16,1731835996.0
"El Salvador started buying 1 Bitcoin EVERY SINGLE DAY on this day 2 years ago. They started at the bottom of the bear market and now HODL: 6,158 BTC worth $518M (Profit $380M).",57,1gt9r2j,CryptoMarkets,https://i.redd.it/fq18bhtdhf1e1.jpeg,9,,2024-11-17 03:11:19,1731834679.0
Gains and Taxes,1,1gt7r9i,CryptoMarkets,https://www.reddit.com/r/CryptoMarkets/comments/1gt7r9i/gains_and_taxes/,11,"Hey everyone, 

Very curious about going big into crypto and the implications that would possibly mean for taxes to calculate a total take home post investment and post cashing out. 

Say I put in 10,000 dollars and that eventually grows into 50,000 in Coinbase or other brokerage account. 

Say I cash out said 50,000. 

As I'm a US citizen, how much of that will go to taxes? 

Thanks for helping me understand this investment further.",2024-11-17 00:45:06,1731825906.0
Hidden Message by Elon About DOGE? Or am I delusional?,0,1gt546c,CryptoMarkets,https://www.reddit.com/r/CryptoMarkets/comments/1gt546c/hidden_message_by_elon_about_doge_or_am_i/,14,"I feel like there’s the message he says, but the message he meant spoke louder to me. What does everyone else think?

https://youtube.com/shorts/yp1Is6y9Te8?si=K3k-3SsV07E1IURx",2024-11-16 21:57:26,1731815846.0
Frozen Funds at Crypto.com,1,1gt3mjn,CryptoMarkets,https://www.reddit.com/r/CryptoMarkets/comments/1gt3mjn/frozen_funds_at_cryptocom/,4,"I've used Crypto.com as my preferred wallet for 3-4 years. Have been doing 4-5 figures transactions regularly during that period of time. 

I attempted to execute my first six figure transaction yesterday in which I attempted to send a large sum to an external wallet. 

After 12 hours, that transaction was cancelled and my account is completely locked up. Customer support started with asking me to reset / redownload app... Then transitioned to a litany of questions about my experience and use of the funds. None of their business.

As it stands currently, everything is frozen with no path forward. Has anyone had similar experience with Crypto.com or any other platform? This is bad business.",2024-11-16 20:33:20,1731810800.0
Am I too late?,39,1gt33s1,CryptoMarkets,https://www.reddit.com/r/CryptoMarkets/comments/1gt33s1/am_i_too_late/,124,"So i am an absolute beginner and want to start Crypto trading I no idea whatsoever .I am not here for extremely quick money ,I am satisfied with reasonable returns .But the market seems so saturated that it feels like there is no opportunity left.

I there is still time kindly guide me through procedure as to how to learn it 

Thanks in advance",2024-11-16 20:04:57,1731809097.0
Popcat to $5??,0,1gt2qe6,CryptoMarkets,https://www.reddit.com/r/CryptoMarkets/comments/1gt2qe6/popcat_to_5/,4,"Pretty much title. Popcat has been on a steady gain, possible $5 popcat price in 1-2 years? Thoughts? ",2024-11-16 19:45:09,1731807909.0
Is Bitcoin Set to Skyrocket? Prediction Markets Reveal What’s Next!,1,1gt0l5w,CryptoMarkets,https://checkcryptoprice.com/prediction-markets-bitcoin-price-forecast/,0,Do you agree with the prediction markets?,2024-11-16 17:57:21,1731801441.0
Investing 2000$ in cryptos for this month,40,1gsxndy,CryptoMarkets,https://www.reddit.com/r/CryptoMarkets/comments/1gsxndy/investing_2000_in_cryptos_for_this_month/,215,"Hi, I am watching a surge in crypto currencies. I aint having much money right now, but now I have some with me. I want to buy crypto for about 2000$, which coins should I invest on ?  
Is dodge coin reliable ?  
I know only of binance as a crypto exchange.",2024-11-16 15:36:04,1731792964.0
