title,score,id,subreddit,url,num_comments,body,created,timestamp
Celestia's Price Decline Following The Grandiose $940M Token Unlock: An Opportunity or a Warning Sign?,2,1gkfysc,CryptoMarkets,https://dailycoin.com/celestia-tia-price-meets-yearly-lows-token-unlocks-at-fault/,1,,2024-11-05 14:07:44,1730837264.0
Shiba Inu Lead Dev Envisions a New Political Arena with United States Strategic Hub Proposal,2,1gkfxzx,CryptoMarkets,https://dailycoin.com/shib-lead-dev-proposes-strategic-hub-for-next-u-s-president/,0,,2024-11-05 14:06:52,1730837212.0
Price differences between exchange and chart sites,2,1gkfdr5,CryptoMarkets,https://www.reddit.com/r/CryptoMarkets/comments/1gkfdr5/price_differences_between_exchange_and_chart_sites/,0,"Complete noob when it comes to trading cryptos, but I've been doing some research about it for a while now. I apologise if this isn't the right place to ask this to.

One thing that I've been starting to notice lately is that sometimes there's a price and chart difference between an exchange and websites like dextools, coinscan or coingecko. I'm mainly talking about big sudden spikes that would only get shown on the exchange, but not on the chart sites, as if nothing happened. I'm aware of ""crypto pumps"" and all of that, and I want to stay away from those, but what concerns me is mainly how does that difference translates to when it comes to security.

Is the exchange itself ""untrustworthy""? Should I stay away from the coin completely instead? Or is it something else?",2024-11-05 13:43:07,1730835787.0
 Thoughts on Staking Rewards in Crypto?,1,1gkfbl9,CryptoMarkets,https://www.reddit.com/r/CryptoMarkets/comments/1gkfbl9/thoughts_on_staking_rewards_in_crypto/,17,"Hey, do you guys think staking rewards are a solid way to make some steady income in the crypto world?",2024-11-05 13:40:31,1730835631.0
"Chainlink, UBS Asset Management, Swift Complete Pilot to Extract Cash From Tokenized Funds",3,1gkbz6g,CryptoMarkets,https://www.coindesk.com/tech/2024/11/05/chainlink-ubs-asset-management-swift-complete-pilot-to-extract-cash-from-tokenized-funds/,1,,2024-11-05 11:21:30,1730827290.0
"Ika Launches on Sui, Revolutionizing MPC Solutions Across Blockchain",44,1gk9yil,CryptoMarkets,https://blockchainreporter.net/ika-launches-on-sui-revolutionizing-mpc-solutions-across-blockchain/,5,,2024-11-05 09:57:15,1730822235.0
Bitcoin Pre-election Dip Reflects Past Patterns: Will the Historic Post-election Rally Follow?,14,1gk5yr7,CryptoMarkets,https://thecryptobasic.com/2024/11/05/bitcoin-pre-election-dip-reflects-past-patterns-will-the-historic-post-election-rally-follow/,14,,2024-11-05 06:53:05,1730811185.0
"Daily Discussion Megathread - November 5, 2024 (GMT+0)",1,1gk50wc,CryptoMarkets,https://www.reddit.com/r/CryptoMarkets/comments/1gk50wc/daily_discussion_megathread_november_5_2024_gmt0/,0,This post contains content not supported on old Reddit. [Click here to view the full post](https://sh.reddit.com/r/CryptoMarkets/comments/1gk50wc),2024-11-05 06:00:33,1730808033.0
Scalping Bitcoin Futures (Binance vs. CME),0,1gk3pnz,CryptoMarkets,https://www.reddit.com/r/CryptoMarkets/comments/1gk3pnz/scalping_bitcoin_futures_binance_vs_cme/,1,"I have access to free Level 2 data for Bitcoin futures from Binance, and I'm able to place orders for Bitcoin futures on CME. Now, I know I could pay for CME's Level 2 data, but I’m wondering if the Binance data is good enough for my scalping on CME futures.

I understand that any small discrepancies are usually taken advantage of by arbitrage bots operating at millisecond speeds. I've also checked both exchanges’ 1m candlestick charts, and they seem pretty close with no huge differences. So for quick scalping, do you think it's feasible to rely on Binance’s L2 data to trade on CME? Or alternatively would you say the Level 2 data between CME and Binance aligns closely enough in practice? Thanks!",2024-11-05 04:32:19,1730802739.0
Anyone tested their order latency on OKX exchange? ,1,1gk1t89,CryptoMarkets,https://www.reddit.com/r/CryptoMarkets/comments/1gk1t89/anyone_tested_their_order_latency_on_okx_exchange/,2,"I am trying to find the latency for order execution on OKX. As per their twitter handle it is mentioned that the average latency is 3 milliseconds..(don’t know which timestamps they are considering) 
I have hosted my server in Alicloud HK region and seeing a round trip time of around 4.5 ms.
Anyone got anything better?",2024-11-05 02:04:24,1730793864.0
"Crypto Bros, Explained without BS - Normie Sentiment
",0,1gjxax1,CryptoMarkets,https://www.youtube.com/watch?v=EIWWKF3UaLU,0,,2024-11-04 21:17:09,1730776629.0
THE US PRESIDENTIAL ELECTION AND THE MARKETS EXPLAINED IN 90 SECONDS (Non Shill Content),5,1gjwiih,CryptoMarkets,https://www.reddit.com/r/CryptoMarkets/comments/1gjwiih/the_us_presidential_election_and_the_markets/,5,"**Voting.**  
US election voting occurs and concludes on November 5th. That's that. Voting is over.

**When does the United States get it's new President?**  
The new President of the USA is not sworn in until January 6th, 2025 at the swearing in ceremony. This is where the peaceful transfer of power from one person to another occurs.

**What happens after the polls close and before January 6th?**  
Public and Legal Consensus of who is the clear winner is an important and hot topic. This occurs prior to the swearing in ceremony on January 6th. Usually when it is generally accepted by the media and citizens that one candidate no longer has a viable path to get the 270 electoral college votes needed to beat the other. Case closed and we can all move on-kind of......

This generally occurs on election night. But it is unknown how many State's results will be contested and for how long these contests will be open for-if at all. These are almost always resolved as soon as possible at the Supreme Court of the United States, as they have the final say on the legality of the contests. Note that it is not uncommon to have contested results go on for days or weeks. ***See Bush/Gore election 2000 which was not resolved until 36 days after the election. Yikes.***

The goal is to have it resolved for the good of the Union as soon as humanly possible, as having it unresolved causes civil discomfort, financial volatility in all financial markets and so on. Tons of FUD.

This election is not expected to be resolved on election night,

***unless there is such a massive landslide for one candidate that it is blatantly obvious***

In other words, if on election night or the next day, if it is a close race-we can expect lawsuits to be filed immediately by both political parties. This would mean more volatility and a step into the unknown, for an unknown amount of time, with an unknown result.

The crypto market like all markets will react with increased volatility anytime it is presented with ""known unknowns"".

So What Happens Next?  
No one knows.

*Series7Trader*",2024-11-04 20:35:30,1730774130.0
General consensus on top 100 alt coins this bull run,27,1gjupd3,CryptoMarkets,https://www.reddit.com/r/CryptoMarkets/comments/1gjupd3/general_consensus_on_top_100_alt_coins_this_bull/,63,"Alts like Algo, Matic, Rndr
Not meme coins 

Are the majority of people still optimistic about a big alt bull run this time?

I started investing in March right before the halfing ( not a good time down 60% on lots).  

Thanks ",2024-11-04 19:05:30,1730768730.0
Bitcoin open interest drops $2 billion ahead of US elections as investor caution sets in,12,1gjoizq,CryptoMarkets,https://cryptoslate.com/insights/bitcoin-open-interest-drops-2-billion-ahead-of-us-elections-as-investor-caution-sets-in/,1,,2024-11-04 14:36:03,1730752563.0
Which coin should I buy as a noob?,11,1gjn3uo,CryptoMarkets,https://www.reddit.com/r/CryptoMarkets/comments/1gjn3uo/which_coin_should_i_buy_as_a_noob/,91,Hey Everyone. I have just setup my binance account and have arond $25-30 to invest. I am a complete noob and wanted to ask which coin should I buy as a first which could give me a small return. Any advice would be helpful. Thank you.,2024-11-04 13:38:08,1730749088.0
Question about liquidity (I'm dumb),6,1gjlrdf,CryptoMarkets,https://www.reddit.com/r/CryptoMarkets/comments/1gjlrdf/question_about_liquidity_im_dumb/,4,"Heyo,

I've been learning crypto trading and I'm interested in trading coins other than the big 3 as well. I was just wondering about the liquidity with coins that have somewhere between 20m - 100m USDT daily volume. So, my Q is: How big orders could I be making at once without running into problems, any estimations? 100k? even 1 mil?
",2024-11-04 12:43:00,1730745780.0
Web3 User Research Surveys for European Based Users,0,1gjldb7,CryptoMarkets,https://www.reddit.com/r/CryptoMarkets/comments/1gjldb7/web3_user_research_surveys_for_european_based/,0,"[Despark.io](http://despark.io/) is a Web3 user research platform dedicated to gathering valuable feedback from crypto users to help shape the development of future tools and platforms. We run surveys/interviews with the goal of bridging the gap between protocols and users. A current survey we have running is targeting European Web3 Users, in which users who take the survey will recieve $15 USDC for the 3-minute survey. 

If you are interested in participating, visit [despark.io](http://despark.io/) and look for the relevant sections to get started. Your feedback is invaluable and feel free to reach out with any questions you may have. ",2024-11-04 12:27:24,1730744844.0
We got a topside rejection. Breakout rejections are bearish. I'm shorting 200x,1,1gjgcqb,CryptoMarkets,https://quantcharts.pro/forum/public/d/95-total-market-cap-falling-wedge-breakout-failure-is-a-bull-trap,0,"https://quantcharts.pro/forum/public/d/95-total-market-cap-falling-wedge-breakout-failure-is-a-bull-trap

So this is bearish approximately 70% of the time. 30% of the time you'll get liquidated if you do a high leverage short. But you can make the loss is back times 10 if you do a precisely timed super high leverage short. I'm starting with a 200x short right now.

",2024-11-04 09:03:23,1730732603.0
Hege is now the 15th trending cryptocurrency on DEX!,3,1gjczjt,CryptoMarkets,https://www.reddit.com/r/CryptoMarkets/comments/1gjczjt/hege_is_now_the_15th_trending_cryptocurrency_on/,0,"This climb has been an exciting journey, but there’s so much more ahead. Every day, Hege grows stronger as more people join our community and believe in the power of what we’re building. Hitting the top 15 on DEX is a amazing achievement, but it’s only a stepping stone – we’re aiming for that #1 spot!

Why does this matter?
 When Hege becomes the most-trending coin on DEX, it’s not just a title. It’s a signal to the entire crypto world that Hege is a force to be reckoned with, an opportunity with 1b potential (and more) . This momentum could push us straight into our all-time high, boosting visibility, liquidity, and growth for everyone in the Hege family. 📈🔥

Imagine the impact: as Hege climbs higher, new investors and communities will take notice, bringing us even more traction and accelerating our journey to the top. The future is bright, but it depends on the strength of our community. So if you’re with us, now’s the time to show it. Every like, comment, and share makes a difference, helping us reach new milestones together!

Let’s make history with Hege and show the world what decentralized finance is all about! ",2024-11-04 06:25:40,1730723140.0
"Daily Discussion Megathread - November 4, 2024 (GMT+0)",1,1gjcjfd,CryptoMarkets,https://www.reddit.com/r/CryptoMarkets/comments/1gjcjfd/daily_discussion_megathread_november_4_2024_gmt0/,1,This post contains content not supported on old Reddit. [Click here to view the full post](https://sh.reddit.com/r/CryptoMarkets/comments/1gjcjfd),2024-11-04 06:00:27,1730721627.0
Maurizio Cattelan’s Comedian (BAN) getting tremendous attention from the market,0,1gjbyap,CryptoMarkets,https://www.reddit.com/r/CryptoMarkets/comments/1gjbyap/maurizio_cattelans_comedian_ban_getting/,0,"The crypto industry is full of crazy things. Can you imagine fruits can be Notorious? You wondered, right? Haha, that's what I'm too. Crypto project BAN has a pinned post on their SNS where they have tagged Banana as the most notorious one. Can you still believe it but why so? Although I have no answer to this question. 

Maurizio Cattelan’s iconoclastic ‘Comedian’ will make its auction debut at Sotheby’s in November, with a $1-1.5 million estimate. First unveiled at Art Basel Miami Beach in 2019. According to a tweet from Michael Bouhanna, he created this meme token BAN and even wasn't expecting its rapid growth driven spontaneously by community efforts. 

The Comedian is an artwork considered highly significant; the reason for the absurdism of the work raises very interesting questions about the nature of art and value. The conceptual questioning of value in Comedian is the main reason behind this token creation, and currently, it's listed on the Bitget exchange and trading with large volumes. ",2024-11-04 05:24:06,1730719446.0
"Without that, could crypto really move forward?",11,1gjaocg,CryptoMarkets,https://www.reddit.com/r/CryptoMarkets/comments/1gjaocg/without_that_could_crypto_really_move_forward/,73,"Honestly, I think we’re finally getting closer to mass adoption of crypto as a payment method. The main barrier, for the longest time, has been the lack of practical ways to spend directly in crypto. Personally, since 2021, I’ve barely used a bank account or card for online payments because the fees are just... insane! But recently, for some subscriptions, I had to try out Redotepay. It’s okay, but when I go through Google Pay, it costs me $12 in the mobil App instead of $8 directly on  site web for my X premium. Why the price difference? Who knows.

As for Bitget Pay, it could actually be a solid alternative. No transaction fees, fast, convenient... sounds better than Google Pay or Apple Pay for regular payments, especially without extra fees. But for now, it’s limited to BTC, ETH, and USDT. It’d be even better if they added TON and TRX.

Anyway, if you guys know of other ways to pay with crypto without having to throw away money on fees, let me know in the comments! Because paying $12 instead of $8 each month... that stings.",2024-11-04 03:54:05,1730714045.0
How to use cold wallet and trade?,5,1gjacoq,CryptoMarkets,https://www.reddit.com/r/CryptoMarkets/comments/1gjacoq/how_to_use_cold_wallet_and_trade/,2,"I need a little help. Until now i use to buy and sell all on the same platfom(kraken). But deposit and buy sell fees are always kinda high. And then i found out about ex. buy usdc on kraken, sending is to phantom wallet and switching usdc for solana on jupiter swap(only example). Does anyone have experience with this, i would like to hear some advice.

And right now i hold some crypto do i swap it all for usdc. But do i send it to my eth or solana cold wallet. etc. etc.

Thanks in advance for any advice.",2024-11-04 03:28:30,1730712510.0
Blockchain could solve the monopolised AI ecosystem,33,1gj9jdc,CryptoMarkets,https://www.artificialintelligence-news.com/news/blockchain-could-solve-the-monopolised-ai-ecosystem/,7,,2024-11-04 02:23:00,1730708580.0
Best Crypto Trading Strategy?,8,1gizdci,CryptoMarkets,https://www.reddit.com/r/CryptoMarkets/comments/1gizdci/best_crypto_trading_strategy/,31,"Hey guys! What do you think is the best crypto trading strategy to start with? From what I see, a lot of popular trading approaches don’t seem to work. Personally, I’m skeptical that drawing lines on charts makes a difference.

What do you use to stay profitable? #Crypto #Trading #CryptoTrading",2024-11-03 16:39:13,1730673553.0
What Solidus and AI can bring to the crypto world ,7,1gizqvl,CryptoMarkets,https://www.reddit.com/r/CryptoMarkets/comments/1gizqvl/what_solidus_and_ai_can_bring_to_the_crypto_world/,9,"Recently, artificial intelligence technology has started to be used in many sectors and we have seen that they are successful. 
Solidus aims to revolutionize the crypto world with AI. They have many solid partnerships and experienced experts on the development team. I think this project in particular should be followed. Solidus, which Congeko ranks 1st among AI projects in terms of market value, can create new opportunities for investors.
",2024-11-03 16:56:12,1730674572.0
Preferred Crypto exchange,20,1gixos0,CryptoMarkets,https://www.reddit.com/r/CryptoMarkets/comments/1gixos0/preferred_crypto_exchange/,36,What’s is everybody’s preferred crypto exchange in the US and why? What are the commissions? I made the move from TOS  to Tradingview so I can trade futures and Crypto on the same program. Just want to see what everybody uses.,2024-11-03 15:25:18,1730669118.0
Little question,8,1gimiai,CryptoMarkets,https://www.reddit.com/r/CryptoMarkets/comments/1gimiai/little_question/,5,"Hi, a question has been bothering me for a long time. Currently, everything and everyone talks about the upcoming bullrun and the subsequent altcoin season as if it were as safe as the amen in the church. I wonder here... most events that are considered so safe should actually be far too predictable for them to definitely happen. Were people in the last cycle just as sure that the bull run was coming? I have not yet witnessed this. In itself, numbers and the cycle level speak for it, for me it seems as if it is all too safe.",2024-11-03 07:11:15,1730639475.0
"Daily Discussion Megathread - November 3, 2024 (GMT+0)",1,1gil94e,CryptoMarkets,https://www.reddit.com/r/CryptoMarkets/comments/1gil94e/daily_discussion_megathread_november_3_2024_gmt0/,3,This post contains content not supported on old Reddit. [Click here to view the full post](https://sh.reddit.com/r/CryptoMarkets/comments/1gil94e),2024-11-03 06:00:20,1730635220.0
Heurist - GPU requirement,2,1gi537c,CryptoMarkets,https://www.reddit.com/r/CryptoMarkets/comments/1gi537c/heurist_gpu_requirement/,4,"What types of hardware are best suited for mining on Heurist, and are there particular GPUs that are more efficient for this purpose? And what resources or training materials does Heurist provide to help new miners get started and optimize their operations? Any and all answers are kindly welcome!

",2024-11-02 15:04:25,1730577865.0
Bitcoin ecosystem and DeFi,0,1ghxh5n,CryptoMarkets,https://www.reddit.com/r/CryptoMarkets/comments/1ghxh5n/bitcoin_ecosystem_and_defi/,10,"When we think of Bitcoin, we often see it as a store of value, a hedge against inflation, but rarely as a tool for decentralized finance (DeFi). Despite its unmatched stability and security, Bitcoin has largely stayed on the sidelines of the DeFi revolution, which has mostly flourished on more flexible blockchains like Ethereum. DeFi has shown its potential: lending, borrowing, earning yields, and managing risk—all without traditional banks. But Bitcoin hasn’t fully tapped into this potential.

BitSmiley aims to bridge this gap by bringing DeFi directly to Bitcoin. The platform is built on three core pillars: an overcollateralized stablecoin to stabilize transactions, secure decentralized lending, and insurance products to cover market risks. Their token is set to list on Bitget on November 6, a significant milestone. The question remains: can BitSmiley provide the liquidity needed to sustain such a robust DeFi ecosystem on Bitcoin?

What are your thoughts?",2024-11-02 09:19:03,1730557143.0
DWF Labs Fires Partner Eugene Ng Over Drink Tampering Allegations,2,1ghv5l9,CryptoMarkets,/r/CryptoCurrency/comments/1ghv0g3/dwf_labs_fires_partner_eugene_ng_over_drink/,0,,2024-11-02 07:19:16,1730549956.0
"Daily Discussion Megathread - November 2, 2024 (GMT+0)",3,1ghtxcr,CryptoMarkets,https://www.reddit.com/r/CryptoMarkets/comments/1ghtxcr/daily_discussion_megathread_november_2_2024_gmt0/,0,This post contains content not supported on old Reddit. [Click here to view the full post](https://sh.reddit.com/r/CryptoMarkets/comments/1ghtxcr),2024-11-02 06:00:17,1730545217.0
Name the key metrics and parameters that are to be sought during the analysis of a new crypto project's potential!,0,1ghs19u,CryptoMarkets,https://www.reddit.com/r/CryptoMarkets/comments/1ghs19u/name_the_key_metrics_and_parameters_that_are_to/,8,"What do you usually look for in a new crypto project? Are there any specific indicators or sets of data upon which you would base your judgment for the long-term viability, growth potential, or simple credibility of a project?",2024-11-02 03:35:12,1730536512.0
MrBeast Faces Controversy Over Alleged Crypto Pump-and-Dump Schemes,2,1ghjs72,CryptoMarkets,https://checkcryptoprice.com/mrbeast-crypto-pump-and-dump-scandal/,1,,2024-11-01 19:04:19,1730505859.0
Bitcoin Price Drop Leads to $250M Bullish Liquidations; Crypto Sentiment Indicator Signals Top,14,1ghpyx0,CryptoMarkets,https://www.coindesk.com/markets/2024/11/01/bitcoin-price-drop-leads-to-250m-bullish-liquidations-crypto-sentiment-indicator-signals-top,1,,2024-11-02 00:54:33,1730526873.0
Question about liquidity,1,1ghp1u1,CryptoMarkets,https://www.reddit.com/r/CryptoMarkets/comments/1ghp1u1/question_about_liquidity/,7,"Kind of a dumb question, but I’m really intrigued with a certain bit of the crypto game. In the instance of Shiba, how did those who became millionaires get their millions out without tanking the liquidity? I’m a little confused honestly.",2024-11-01 23:51:55,1730523115.0
How do you look for a gem/crypto coins?,13,1ghmfrq,CryptoMarkets,https://www.reddit.com/r/CryptoMarkets/comments/1ghmfrq/how_do_you_look_for_a_gemcrypto_coins/,34,"Hello everyone, i would like to ask what is your strategy on looking for new coins, what indicator you use?
Can i get some insight of your strategy?",2024-11-01 21:20:37,1730514037.0
Metcalfe effect o push BTC to $1BN a coin by 2038,0,1gh7no4,CryptoMarkets,https://www.reddit.com/r/CryptoMarkets/comments/1gh7no4/metcalfe_effect_o_push_btc_to_1bn_a_coin_by_2038/,3,"Fidelity analysts wrote a report stating that the Metcalfe effect whereby the value of a network increases exponentially as its usage increases, means that BTC could exceed $1BN a coin by 3038. This is attributed to a weakening of the dollar and fiat currency and an adoption of the BTC network. It seems a bit crazy to me, itb would need a major transfer of wealth from FIAT to digital currency. However i suppose an adoption event whereby people start using digital currency rather than fiat would mean trillions in inflows, which would mean multi million dollar BTC at least (assuming its where the fiat moves to) 

  
[Bitcoin price predictions - $1 BILLION by 2050](https://www.youtube.com/watch?v=-DFCc2HNDFw) ",2024-11-01 10:10:30,1730473830.0
"Daily Discussion Megathread - November 1, 2024 (GMT+0)",1,1gh2oxp,CryptoMarkets,https://www.reddit.com/r/CryptoMarkets/comments/1gh2oxp/daily_discussion_megathread_november_1_2024_gmt0/,9,This post contains content not supported on old Reddit. [Click here to view the full post](https://sh.reddit.com/r/CryptoMarkets/comments/1gh2oxp),2024-11-01 06:00:25,1730458825.0
Microstrategy is raising 42 billion $ to buy more Bitcoin in next 3 years.,44,1gh1y0j,CryptoMarkets,https://www.coindesk.com/business/2024/10/30/michael-saylors-microstrategy-plans-to-raise-42b-to-buy-more-bitcoin-over-next-3-years/amp/,15,,2024-11-01 05:07:33,1730455653.0
Tether investigation ,1,1ggtaqy,CryptoMarkets,https://www.reddit.com/r/CryptoMarkets/comments/1ggtaqy/tether_investigation/,0,Hello im new to this but if tether found guilty what would happen to all the USDT?  Do they get wiped out? If so then should i start building positions ? Help? ,2024-10-31 19:29:40,1730420980.0
Leverage exchanges in US,8,1ggwfdr,CryptoMarkets,https://www.reddit.com/r/CryptoMarkets/comments/1ggwfdr/leverage_exchanges_in_us/,5,"What exchanges do you guys use in the US to trade futures? 
Used to do mexc and kucoin but they don’t seem to work anymore.",2024-10-31 22:21:57,1730431317.0
"Bitcoin Google Search Interest Remains Flat Despite $73,600 Surge: What History Tells Us",12,1ggt39m,CryptoMarkets,https://thecryptobasic.com/2024/10/31/bitcoin-google-search-interest-remains-flat-despite-73600-surge-what-history-tells-us/,8,,2024-10-31 19:18:57,1730420337.0
Need help with XEGGEX,1,1ggqi06,CryptoMarkets,https://www.reddit.com/r/CryptoMarkets/comments/1ggqi06/need_help_with_xeggex/,0,I try to withdraw my crypto assets from xeggex to another wallet or exchange and won't go through. Why does processing this doesn't get past step 1?,2024-10-31 17:11:07,1730412667.0
