title,score,id,subreddit,url,num_comments,body,created,timestamp
I really need some advice on my crypto portfolio (1st cycle),1,1g936d1,CryptoMarkets,https://www.reddit.com/r/CryptoMarkets/comments/1g936d1/i_really_need_some_advice_on_my_crypto_portfolio/,0,"Hi everyone,

This is my first crypto cycle, and I think I made a beginner’s mistake by listening too much to the crowd... 😅 I currently hold 13 cryptos in my portfolio, and I’m starting to wonder if I have too many for a beginner. Here’s the list:

* Bitcoin (BTC)
* Ethereum (ETH)
* Solana (SOL)
* Chainlink (LINK)
* Near (NEAR)
* Avalanche (AVAX)
* Render (RNDR)
* Toncoin (TON)
* Sui (SUI)
* Superverse (SUPER)
* Bittensor (TAO)
* [Fetch.ai](http://Fetch.ai) (FET)
* Beam (BEAM)

**What do you think?** Do I have too many projects for a beginner's portfolio? And did I make good choices in terms of cryptos?

I’m considering reducing the number of projects and focusing on fewer cryptos with a new allocation. Here’s my plan:

# Possible new allocation:

# 30% Large Caps:

* Bitcoin (BTC): 10%
* Solana (SOL): 10%
* Ethereum (ETH): 10%

# 30% Mid Caps:

* Chainlink (LINK): 10%
* Avalanche (AVAX): 10%
* Toncoin (TON): 5%
* Aave (AAVE): 5%

# 40% Small Caps:

* Render (RNDR): 10%
* Bittensor (TAO): 10%
* Near (NEAR): 10%
* Sui (SUI): 10%

If I switch to this new strategy, what should I do with the cryptos I’m removing (like **Superverse,** [**Fetch.ai**](http://Fetch.ai)**, Beam**)? Should I hold them for the long term or convert them to strengthen my other positions?

I’d really appreciate your advice since I feel a bit lost right now. But I don’t think it’s too late to adjust my portfolio! 🙏

Thanks in advance, and best regards!",2024-10-21 17:48:07,1729550887.0
"What a $1,000 Bitcoin Investment is Worth Today",1,1g94dez,CryptoMarkets,https://checkcryptoprice.com/what-a-1000-bitcoin-investment-is-worth-today/,0,Damn it!,2024-10-21 18:44:18,1729554258.0
"CYPTO.COM ""WARNING""",0,1g90uhu,CryptoMarkets,https://www.reddit.com/r/CryptoMarkets/comments/1g90uhu/cyptocom_warning/,20,"**Subject: Frustrating Experience with** [**Crypto.com**](http://Crypto.com) **Support and Access to Funds**

I’m writing to share my ongoing frustrating experience with Crypto.com’s customer service and their DeFi Wallet. Recently, I transferred crypto funds into my wallet, but now they are frozen due to an issue with gas fees. Here’s the situation:

1. **Frozen Funds**: My funds (approximately $726 worth of ETH) are inaccessible because I can't use them to cover gas fees.
2. **Customer Service Nightmare**: I've spent over 10 hours communicating with their customer service through their messaging platform. Every time, I’m met with the same excuses about needing to deposit ACH funds into my fiat wallet to get gas, which takes an absurd 7 days to process.
3. **Inaccessible Support**: Their lack of phone support has made resolving this issue even more frustrating. The message board often kicks me out, forcing me to log in repeatedly to provide the extensive screenshots they request.
4. **Lack of Knowledge and Help**: The representatives I've interacted with seem poorly trained, and I often feel like I’m chatting with someone who is more preoccupied than focused on helping me resolve my problem.

After three days of getting nowhere, I plan to escalate this issue. I’m sharing my experience here on Reddit and will be filing complaints with the Blockchain Association, SEC, and CFPB.",2024-10-21 16:06:40,1729544800.0
Some advice to newer people about this Bitcoin rise,23,1g8xkfl,CryptoMarkets,https://www.reddit.com/r/CryptoMarkets/comments/1g8xkfl/some_advice_to_newer_people_about_this_bitcoin/,41,"Hello there people,

I just wanted to remind you all about the fact that you should stay rational right now. I understand that with Bitcoin rising towards 70k, one or the other might succumb to the feeling of FOMO. And please, I'm telling you: Don't fall for your emotions. Despite what everyone on the internet or the news might be telling you currently, Bitcoin is absolutely NOT guaranteed to head higher from here. We have been in a range for the past 7 months and it's possible that we keep doing that for another few months, who knows? Don't think that Bitcoin 100% has to start going ""because we are in Q4"" or some shit.

Especially the times where everyone is screaming that Bitcoin ""is breaking out!!!"" are the ones where most people get it wrong. We could also go below 50k again and I'm asking you: Are you prepared for that?

I'm not saying we will necessarily go there (though I personally do have my reasons to believe this), but if that scenario is not on your radar, then you shouldn't be in the markets. Don't overleverage yourself, and practice caution. Don't get hyper bullish and don't FOMO in. Be prepared for both cases, up and down, we are not out of the woods yet.",2024-10-21 13:54:34,1729536874.0
Ledger doesn't allow delivery to PO box... After their data breach they've got some nerve forcing us to trust them with our home address.,13,1g8sogx,CryptoMarkets,https://www.reddit.com/r/CryptoMarkets/comments/1g8sogx/ledger_doesnt_allow_delivery_to_po_box_after/,16,"So [Ledger.com](http://Ledger.com), the company which not too long ago [suffered a data breach which exposed all the purchase info of over 270k users (emails, physical address, phone numbers, purchase details)](https://cointelegraph.com/news/ledger-data-leak-a-simple-mistake-exposed-270k-crypto-wallet-buyers). Now forces you to deliver their products to a home address and rejects PO boxes in the address field. 

Using a PO Box was the only thing that saved some victims from having their phsycial address exposed to the world in connection with an expensive crypto wallet (meaning they likely have fair amounts of crypto). Now ledger has the audacity to remove that one layer of protection buyers had by forbidding that option. 

There's been countless people exposing the data collection ledger engages in on their application and now it seems they're prioritizing collecting that data from buyers over the customer's real world safety. Just ridiculous. Guess it's time to research some quality alternatives. ",2024-10-21 10:38:44,1729525124.0
Recover stuck SUI,1,1g8roa7,CryptoMarkets,https://www.reddit.com/r/CryptoMarkets/comments/1g8roa7/recover_stuck_sui/,1,"TL:DR version, I bridged some SUI tokens to an Aptos address and want to know if it's possible to recover the SUI, or bridge it to another chain.  
  
  
I went to rocketx to bridge some SOL-usdc to SUI. I downloaded the Martian wallet (first mistake) in order to get a SUI wallet before the bridge. The bridge worked fine and got a success message that the usdc successfully bridged to SUI. However upon opening the wallet I quickly realized my second mistake, that the Martian wallet's default chain is Aptos, not SUI. I can see the SUI just hanging out on my Aptos address via Sui Explorer . But can't really ""get to it"". I've contacted rocketx, they claim they can't help me. Martian Wallet has no support or staff, or anyone you can contact (their discord is a joke, messages turned off on X, and their website auto closes any tickets).  
  
I feel like since I was able to bridge it to a wrong address, I should be able to bridge it to a correct address be it SOL, ETH, etc. I keep reading there are ""ways"" to do something like this, but not sure if it's possible (yet) since SUI is fairly new. Is this just lost for now or is there some kind of trick to bridge, swap or get the SUI unstuck?",2024-10-21 09:57:10,1729522630.0
What are Zero Trust Protocols and Why Do They Matter for Web3 Interoperability?,27,1g8rny6,CryptoMarkets,https://www.cryptotimes.io/2024/10/03/zero-trust-protocols-importance-for-web3-interoperability/,10,,2024-10-21 09:56:46,1729522606.0
Tips for Rotational Trading of Meme Coins?,2,1g8phs6,CryptoMarkets,https://www.reddit.com/r/CryptoMarkets/comments/1g8phs6/tips_for_rotational_trading_of_meme_coins/,3,"Hi all,

I'm interested in doing rotational trades with meme coins, but they can be unpredictable, and timing their pumps is challenging. I'm looking for any strategies or tips that could help with this type of trading, including:

1. How to identify signals that a meme coin might be about to pump.
2. Tools or platforms you recommend for monitoring trends and volatility in meme coins.
3. Risk management techniques for trading highly volatile assets.
4. Any patterns, indicators, or metrics that you've found helpful when trading meme coins.

I’d appreciate any advice or experiences you can share. Thanks in advance.",2024-10-21 08:19:01,1729516741.0
What’s your strategy for dealing with illiquid markets?,5,1g8om6z,CryptoMarkets,https://www.reddit.com/r/CryptoMarkets/comments/1g8om6z/whats_your_strategy_for_dealing_with_illiquid/,3,I’ve noticed that trading in illiquid markets can lead to bigger price slippage and less predictability. How do you handle trading in these environments?,2024-10-21 07:35:55,1729514155.0
"Daily Discussion Megathread - October 21, 2024 (GMT+0)",1,1g8mxxa,CryptoMarkets,https://www.reddit.com/r/CryptoMarkets/comments/1g8mxxa/daily_discussion_megathread_october_21_2024_gmt0/,0,This post contains content not supported on old Reddit. [Click here to view the full post](https://sh.reddit.com/r/CryptoMarkets/comments/1g8mxxa),2024-10-21 06:00:30,1729508430.0
BlackRock Discusses Using BUIDL Tokens as Collateral on Crypto Exchanges,4,1g8l88y,CryptoMarkets,https://www.reddit.com/r/CryptoMarkets/comments/1g8l88y/blackrock_discusses_using_buidl_tokens_as/,0,"

BlackRock is reportedly in discussions with several centralized exchanges to allow its BUIDL fund to be used as collateral in derivatives trading. According to a Bloomberg report on October 18, sources familiar with the matter mentioned that exchanges such as Binance, OKX, and Deribit are involved in these talks.

This initiative is part of Wall Street's broader effort to deepen its involvement in the digital asset market. The BlackRock BUIDL token requires a minimum investment of $5 million and is specifically designed for qualified institutional investors.

Crypto brokers FalconX and Hidden Road already allow their hedge fund clients to use BUIDL as collateral, while custodian Komainu recently announced that its clients could trade through Hidden Road using the token as collateral.

Market Expansion
Direct acceptance of BUIDL on platforms like Binance and Deribit would significantly expand its market reach. The crypto derivatives market moved nearly $3.5 trillion in September, which is almost four times larger than the spot market, according to data from Coinglass and The Block.

Although BlackRock has not commented on this initiative, Deribit CEO Luuk Strijers acknowledged that the exchange is considering various tokens, including BUIDL. However, Strijers emphasized the need for regulatory approval and a deeper understanding of the token’s technical aspects before proceeding.

DeFi and Traditional Finance Intertwine
The report about the world's largest asset manager deepening its involvement in crypto coincides with reports of crypto-native companies venturing into traditional finance. Tether Limited, the issuer of the Tether USD (USDT) stablecoin, is reportedly considering offering loans to commodity trading companies.

This move may represent an alternative path for crypto firms to capitalize on the $5.2 billion in profits recorded in the first half of this year.

Moreover, decentralized finance (DeFi) protocols are already exploring the use of BUIDL tokens in financial instruments. On August 26, the leading money market platform Aave proposed a new GHO Stability Module (GSM) based on BlackRock’s token fund.

GSM is a mechanism created by Aave to help maintain the stability of its ecosystem's stablecoin, GHO. When users swap USD Coin (USDC) for GHO, this new module will enable the exchange of USDC for BUIDL. According to the proposal, this will help stabilize GHO while providing additional value to users through the yields offered by BlackRock.

Additionally, stablecoin issuer Ethena Labs unveiled a new stablecoin fully backed by BUIDL on September 26. UStb will offer an alternative to Ethena's USDe, attracting users with more conservative risk appetites.


source: https://news.nanovest.io/black-rock/black-rock-bahas-penggunaan-token-buidl-sebagai-jaminan-di-bursa-kripto",2024-10-21 04:01:23,1729501283.0
Algorithmic Trading Platforms for Crypto Investing,20,1g8k8z9,CryptoMarkets,https://www.reddit.com/r/CryptoMarkets/comments/1g8k8z9/algorithmic_trading_platforms_for_crypto_investing/,6,"Algorithmic trading is a perfect way for those looking to seize every market opportunity without being swayed by emotions. Since the system is programmed with your specific entry and exit rules, it executes trades based on logic, not feelings, ensuring efficiency without manual intervention. 

Here are my top picks:

Margex: This platform impressed me with features that cater to both beginners and advanced traders, including copy trading. With just one click, less-experienced traders can benefit from expert strategies. 

Coinrule: Designed to bring sophisticated trading tools to regular traders, it connects with platforms like Binance, Coinbase Pro, and Kraken via an API, giving users access to hedge-fund-level strategies. 

SuperBots: A platform offering a range of vaults that spread your investment across top-performing algorithms. I particularly appreciate the new Swing Sniper BTC vault, which finds reliable entry and exit points, combining swing and day trading strategies for optimized results. The secure, audited smart contracts provide peace of mind. 

Cryptohopper: For those who prefer to build their own custom bots, Cryptohopper enables automated trading based on your strategy, market conditions, and risk preferences. 

Mastering trading bots takes time and experience, especially if you're unfamiliar with terms like ""bullish,"" ""bearish,"" or ""market cap."" It might be wise to explore the basics before diving into algorithmic trading. 

Which platform do you find most useful?",2024-10-21 02:43:12,1729496592.0
Anyone using Metask ,0,1g8gxcu,CryptoMarkets,https://www.reddit.com/r/CryptoMarkets/comments/1g8gxcu/anyone_using_metask/,0,I have a unavailable conversion rate on a crypto it's on a old address and I need to know how to put the new address on and cash out? So anyone have lovely crypto? ,2024-10-20 22:49:31,1729482571.0
Closed My Bitcoin Position After 3 Months – Need Your Thoughts!,6,1g8gwoy,CryptoMarkets,https://www.reddit.com/r/CryptoMarkets/comments/1g8gwoy/closed_my_bitcoin_position_after_3_months_need/,36,"Hey everyone, I need some advice (or maybe just some reassurance 😅).

So, I held onto a Bitcoin position for **3 months** and finally decided to close it. The good news? I made a **$1,500 profit** (minus \~$400 in funding fees - yay!?) But here’s the thing—I was holding it with **6x leverage** the entire time. 😬

Now, I know I came out alive, but I can’t help wondering…

* Was it a mistake to hold something for 3 months in Futures? I ended up paying $400 in funding fee.
* How many days do you generally keep your position?
* Any tips on managing leveraged positions better?

Honestly, the stress of holding it for so long with leverage was a bit *much*. Would love to hear your suggestions or similar stories. How do you all handle trades like this?",2024-10-20 22:48:23,1729482503.0
Kucoin stole my funds,45,1g859kl,CryptoMarkets,https://www.reddit.com/r/CryptoMarkets/comments/1g859kl/kucoin_stole_my_funds/,48,"Hello my fellow crypto friends. I want to share very unpleasant situation which happen to me and can happen to any of you guys using Kucoin exchange. 

I was fully KYCed customer of Kucoin for 5 years. I accumulated some small coins during last bear investing about 20k $. When BTC reached 70k+, my portfolio grew to wooping 110k$. I decided to take profits and when i tried to sell coins i got notification that my account is locked. Kucoin asked for additional information which i provided in less than 24h. This was already 5 months ago and since initial contact Kucoin didnt provide any specific details, why my account is locked, and when it will be unlocked, nor they asked for additional information from my side. Since they halted my trading, value of my coins dropped from 110k to 40k $ making unrealised loss of 70k$. 

Kucoin is stealing users funds and should be avoided at all costs!

Only purpose of this thread is that other people in crypto space are aware of such risks. If i save 10 people from what happen to me I am already happy",2024-10-20 13:21:36,1729448496.0
Crypto to cash,4,1g82we8,CryptoMarkets,https://www.reddit.com/r/CryptoMarkets/comments/1g82we8/crypto_to_cash/,12,"I’m UK based. I’ve got a legacy account with Binance with a mix of ETH, BNB, SOL and a few others. 

I’m conscious of the changes over the last few years but wondered what the best and cheapest way was to get my crypto out of Binance and into my bank account as cash? 

Last time I did it I used Exodus wallet (transferred from Binance to Exodus) but I don’t think they allow cash withdrawals now? 

Anyway, was hoping some of you might have some experience and suggestions on this? ",2024-10-20 11:39:32,1729442372.0
